### ISSUE TITLE
HTTPS transactions in transparent mode & using iprange are broken

### ISSUE THREAD

**Issue by darrentodd** [processone/tsung#264]
HTTPS transactions in transparent mode & using iprange are broken - with a setup of:

```
<tsung loglevel="warning" version="1.0">
<clients>
<client host="bfs-dl360g9-09" cpu="72" maxusers="19999999" weight="10">
<iprange version="v4" value="1.0-19.0-254.1-254"/>
</client>
</clients>
<servers>
<server host="1.loadtest.local" port="443" type="ssl"/>
<server host="5.loadtest.local" port="443" type="ssl"/>
<server host="13.loadtest.local" port="443" type="ssl"/>
<server host="17.loadtest.local" port="443" type="ssl"/>
</servers>
<load>
<arrivalphase phase="1" duration="4500" unit="minute">
<users arrivalrate="10" unit="second"/>
</arrivalphase>
</load>
<options>
<option name="ssl_reuse_sessions" value="false"/>
<option type="ts_http" name="user_agent">
<user_agent probability="100">LoadTestUserAgent1-123456789123456789</user_agent>
</option>
<option name="ip_transparent" value="true"/>
<option name="idle_timeout" value="10000"/>
<option name="glocal_ack_timeout" value="5000"/>
</options>
<sessions>
<session name="http-web" probability="100" type="ts_http">
<setdynvars sourcetype="file" fileid="files" delimiter="\n" order="random">
<for from="1" to="10" incr="1" var="i">
<transaction name="web">
<http url="/ method="GET" version="1.1"></http>
</request>
</transaction>
</for>
</session>
</sessions>
</tsung>
```

This test fails - seeing in the logs:

```
=ERROR REPORT==== 13-Oct-2017::15:22:56 ===
** State machine <0.419.0> terminating 
** Last message in was {tcp,#Port<0.1532>,
                            <<21,3,3,0,2,1,112,22,3,3,0,85,2,0,0,81,3,3,89,
                              224,204,69,250,192,106,42,242,154,154,223,88,2,
                              35,200,70,61,152,158,206,137,5,163,62,254,183,
                              178,122,56,123,173,32,78,128,107,99,158,139,128,
                              249,71,40,94,113,78,205,34,240,222,43,71,218,
                              135,103,251,37,211,9,56,29,113,126,107,84,0,107,
                              0,0,9,0,0,0,0,255,1,0,1,0,22,3,3,3,101,11,0,3,
                              97,0,3,94,0,3,91,48,130,3,87,48,130,2,63,160,3,
                              2,1,2,2,9,0,238,107,27,251,218,186,177,213,48,
                              13,6,9,42,134,72,134,247,13,1,1,11,5,0,48,66,49,
                              11,48,9,6,3,85,4,6,19,2,85,75,49,21,48,19,6,3,
                              85,4,7,12,12,68,101,102,97,117,108,116,32,67,
                              105,116,121,49,28,48,26,6,3,85,4,10,12,19,68,
                              101,102,97,117,108,116,32,67,111,109,112,97,110,
                              121,32,76,116,100,48,30,23,13,49,54,49,49,51,48,
                              49,54,51,48,51,48,90,23,13,49,54,49,50,51,48,49,
                              54,51,48,51,48,90,48,66,49,11,48,9,6,3,85,4,6,
                              19,2,85,75,49,21,48,19,6,3,85,4,7,12,12,68,101,
                              102,97,117,108,116,32,67,105,116,121,49,28,48,
                              26,6,3,85,4,10,12,19,68,101,102,97,117,108,116,
                              32,67,111,109,112,97,110,121,32,76,116,100,48,
                              130,1,34,48,13,6,9,42,134,72,134,247,13,1,1,1,5,
                              0,3,130,1,15,0,48,130,1,10,2,130,1,1,0,205,205,
                              144,3,42,139,144,69,167,232,217,212,200,204,203,
                              61,81,17,72,20,249,36,83,70,207,121,115,16,58,
                              55,233,61,122,88,113,3,96,172,107,16,74,235,102,
                              159,52,77,182,131,54,185,194,138,191,151,58,211,
                              127,101,31,154,52,145,209,97,28,212,114,144,123,
                              118,233,49,127,228,88,22,61,13,96,59,48,172,224,
                              77,59,201,179,119,121,132,153,157,216,108,237,
                              231,222,23,166,121,95,230,43,147,95,231,70,22,
                              64,75,253,196,49,225,216,71,131,116,130,88,71,
                              108,217,113,160,96,60,98,163,148,56,101,218,105,
                              54,112,115,55,80,109,172,156,64,138,107,72,235,
                              42,250,107,91,179,58,109,183,141,104,171,93,36,
                              102,15,251,84,178,153,157,211,204,101,247,132,
                              80,18,105,81,37,105,60,219,151,103,82,80,131,30,
                              255,31,11,153,130,112,73,209,25,114,227,174,175,
                              218,43,67,72,61,84,108,107,129,97,136,198,8,95,
                              139,225,51,142,238,71,233,25,154,236,162,108,
                              117,42,20,240,231,55,193,78,126,112,89,5,165,29,
                              71,8,122,138,42,76,184,168,147,89,105,30,238,
                              134,227,193,91,2,3,1,0,1,163,80,48,78,48,29,6,3,
                              85,29,14,4,22,4,20,47,142,141,44,29,145,71,163,
                              239,15,10,131,48,6,223,44,27,175,52,111,48,31,6,
                              3,85,29,35,4,24,48,22,128,20,47,142,141,44,29,
                              145,71,163,239,15,10,131,48,6,223,44,27,175,52,
                              111,48,12,6,3,85,29,19,4,5,48,3,1,1,255,48,13,6,
                              9,42,134,72,134,247,13,1,1,11,5,0,3,130,1,1,0,
                              27,31,168,218,28,198,229,239,149,147,211,132,
                              120,213,158,134,127,30,16,226,91,221,233,157,13,
                              22,106,127,169,253,188,121,16,168,27,123,251,52,
                              141,61,111,236,205,153,43,35,246,182,172,55,188,
                              144,113,91,46,212,140,147,242,237,131,237,40,39,
                              222,117,189,92,140,101,69,227,92,19,114,170,112,
                              240,240,99,165,161,19,47,150,86,123,11,215,182,
                              50,115,135,60,101,231,225,140,24,78,166,176,245,
                              248,55,247,212,129,250,49,206,34,186,10,223,92,
                              209,171,123,5,209,244,131,181,213,102,250,75,
                              203,27,233,93,207,116,96,35,160,102,89,88,210,
                              115,25,2,197,224,192,39,8,49,51,208,161,65,20,
                              59,184,169,159,117,152,139,90,82,71,67,213,25,
                              49,186,124,101,207,129,78,58,222,182,202,166,
                              213,213,56,5,152,122,82,9,191,145,124,243,20,
                              167,195,36,62,31,248,24,146,47,3,191,201,40,210,
                              221,215,186,74,255,21,23,142,130,195,160,221,
                              132,111,209,183,177,213,33,163,141,50,110,80,
                              167,232,160,88,134,123,10,218,114,115,175,80,37,
                              157,38,64,6,50,85,165,155,148,225,191,107,22,3,
                              3,2,15,12,0,2,11,0,128,214,125,228,64,203,187,
                              220,25,54,214,147,211,74,253,10,213,12,132,210,
                              57,164,95,82,11,184,129,116,203,152,188,233,81,
                              132,159,145,46,99,156,114,251,19,180,180,215,23,
                              126,22,213,90,193,121,186,66,11,42,41,254,50,74,
                              70,122,99,94,129,255,89,1,55,123,237,220,253,51,
                              22,138,70,26,173,59,114,218,232,134,0,120,4,91,
                              7,167,219,202,120,116,8,125,21,16,234,159,204,
                              157,221,51,5,7,221,98,219,136,174,170,116,125,
                              224,244,214,226,189,104,176,231,57,62,15,36,33,
                              142,179,0,1,2,0,128,19,181,132,255,101,72,249,
                              99,26,69,75,192,126,60,191,49,63,153,169,65,145,
                              139,227,147,102,16,28,252,243,192,22,150,133,4,
                              178,163,55,178,182,103,226,73,252,141,6,83,184,
                              27,186,178,48,165,54,204,206,226,167,2,185,193,
                              59,12,214,160,79,206,82,130,14,38,24,242,228,36,
                              191,58,63,202,55,183,82,8,179,219,122,118,167,
                              132,68,28,226,13,171,89,55,0,164,208,232,187,
                              212,237,11,87,31,233,150,137,51,153,192,230,117,
                              194,72,35,198,12,43,148,133,37,27,226,199,17,
                              113,220,6,1,1,0,111,251,229,77,151,252,187,232,
                              116,224,42,228,113,46,87,154,124,2,120,224,82,
                              172,207,188,163,65,3,239,149,214,66,147,1,84,
                              217,5,220,63,157,36,112,169,173,104,96,140,18,
                              56,71,223,198,46,219,159,236,61,63,156,171,83,
                              112,196,188,73,137,72,116,50,137,184,8,213,158,
                              11,187,229,162,227,36,190,95,136,207,105,51,200,
                              243,16,150,91,16,243,123,110,250,160,128,41,138,
                              134,222,96,196,141,227,146,243,241,75,28,192,
                              194,157,195,236,34,229,106,59,30,128,91,172,216,
                              174,227,179,11,175,134,7,10,31,240,189,206,73,
                              226,72,170,207,174,167,108,98,231,242,56,42,251,
                              201,130,149,154,87,162,25,255,114,144,143,155,
                              239,44,187,195,63,50,148,176,125,90,110,11,53,
                              219,194,222,53,5,238,247,112,124,58,89,189,223,
                              12,51,117,142,165,126,95,192,113,151,239,230,
                              185,91,118,62,141,76,34,36,194,125,250,19,118>>}
** When State == hello
**      Data  == {state,client,
                     {#Ref<0.0.0.676>,<0.417.0>},
                     gen_tcp,tls_connection,tcp,tcp_closed,tcp_error,
                     "23129.loadtest.local",443,#Port<0.1532>,
                     {ssl_options,undefined,
                         [{3,3},{3,2},{3,1}],
                         verify_none,
                         {#Fun<ssl.1.94144976>,[]},
                         false,false,undefined,1,<<>>,undefined,<<>>,
                         undefined,undefined,undefined,<<>>,undefined,
                         undefined,undefined,undefined,undefined,
                         [<<0,107>>,
                          <<0,106>>,
                          <<0,61>>,
                          <<0,103>>,
                          <<0,64>>,
                          <<0,60>>,
                          <<0,57>>,
                          <<0,56>>,
                          <<0,53>>,
                          <<0,22>>,
                          <<0,19>>,
                          <<0,10>>,
                          <<0,51>>,
                          <<0,50>>,
                          <<0,47>>,
                          <<0,5>>,
                          <<0,4>>,
                          <<0,21>>,
                          <<0,9>>],
                         #Fun<ssl.0.94144976>,false,268435456,false,undefined,
                         undefined,false,undefined,undefined,true,undefined,
                         true},
                     {socket_options,binary,0,0,0,once},
                     {connection_states,
                         {connection_state,
                             {security_parameters,
                                 <<0,0>>,
                                 1,0,0,0,0,0,0,0,0,0,0,undefined,undefined,
                                 undefined,undefined},
                             undefined,undefined,undefined,undefined,0,
                             undefined,undefined,undefined},
                         {connection_state,
                             {security_parameters,undefined,1,undefined,
                                 undefined,undefined,undefined,undefined,
                                 undefined,undefined,undefined,undefined,
                                 undefined,undefined,
                                 <<89,224,204,64,68,254,7,222,178,197,157,232,
                                   129,29,172,21,220,151,148,191,128,165,246,
                                   24,11,131,135,178,18,177,248,114>>,
                                 undefined,undefined},
                             undefined,undefined,undefined,undefined,
                             undefined,undefined,undefined,undefined},
                         {connection_state,
                             {security_parameters,
                                 <<0,0>>,
                                 1,0,0,0,0,0,0,0,0,0,0,undefined,undefined,
                                 undefined,undefined},
                             undefined,undefined,undefined,undefined,1,
                             undefined,undefined,undefined},
                         {connection_state,
                             {security_parameters,undefined,1,undefined,
                                 undefined,undefined,undefined,undefined,
                                 undefined,undefined,undefined,undefined,
                                 undefined,undefined,
                                 <<89,224,204,64,68,254,7,222,178,197,157,232,
                                   129,29,172,21,220,151,148,191,128,165,246,
                                   24,11,131,135,178,18,177,248,114>>,
                                 undefined,undefined},
                             undefined,undefined,undefined,undefined,
                             undefined,undefined,undefined,undefined}},
                     {protocol_buffers,[],<<>>,<<>>,[]},
                     {[[1,
                        <<0,0,130>>,
                        <<3,3,89,224,204,64,68,254,7,222,178,197,157,232,129,
                          29,172,21,220,151,148,191,128,165,246,24,11,131,
                          135,178,18,177,248,114,0,0,40,0,255,0,107,0,106,0,
                          61,0,103,0,64,0,60,0,57,0,56,0,53,0,22,0,19,0,10,0,
                          51,0,50,0,47,0,5,0,4,0,21,0,9,1,0,0,49,0,0,0,25,0,
                          23,0,0,20,50,51,49,50,57,46,108,111,97,100,116,101,
                          115,116,46,108,111,99,97,108,0,13,0,16,0,14,6,1,5,
                          1,4,1,3,1,2,1,2,2,1,1>>]],
                      []},
                     20498,
                     {session,<<>>,undefined,undefined,undefined,undefined,
                         undefined,undefined,new,63675127376,undefined},
                     32789,ts_ssl_session_cache,
                     {3,3},
                     false,undefined,
                     {undefined,undefined},
                     undefined,undefined,undefined,undefined,undefined,
                     undefined,undefined,undefined,undefined,24595,
                     #Ref<0.0.0.679>,undefined,<<>>,
                     {false,first},
                     {<0.417.0>,#Ref<0.0.0.677>},
                     undefined,
                     {[],[]},
                     false,true,false,undefined,undefined}
** Reason for termination = 
** {function_clause,
       [{tls_connection,handle_alert,
            [{alert,1,112,{"tls_connection.erl",375}},
             hello,
             {state,client,
                 {#Ref<0.0.0.676>,<0.417.0>},
                 gen_tcp,tls_connection,tcp,tcp_closed,tcp_error,
                 "23129.loadtest.local",443,#Port<0.1532>,
                 {ssl_options,undefined,
                     [{3,3},{3,2},{3,1}],
                     verify_none,
                     {#Fun<ssl.1.94144976>,[]},
                     false,false,undefined,1,<<>>,undefined,<<>>,undefined,
                     undefined,undefined,<<>>,undefined,undefined,undefined,
                     undefined,undefined,
                     [<<0,107>>,
                      <<0,106>>,
                      <<0,61>>,
                      <<0,103>>,
                      <<0,64>>,
                      <<0,60>>,
                      <<0,57>>,
                      <<0,56>>,
                      <<0,53>>,
                      <<0,22>>,
                      <<0,19>>,
                      <<0,10>>,
                      <<0,51>>,
                      <<0,50>>,
                      <<0,47>>,
                      <<0,5>>,
                      <<0,4>>,
                      <<0,21>>,
                      <<0,9>>],
                     #Fun<ssl.0.94144976>,false,268435456,false,undefined,
                     undefined,false,undefined,undefined,true,undefined,true},
                 {socket_options,binary,0,0,0,once},
                 {connection_states,
                     {connection_state,
                         {security_parameters,
                             <<0,0>>,
                             1,0,0,0,0,0,0,0,0,0,0,undefined,undefined,
                             undefined,undefined},
                         undefined,undefined,undefined,undefined,1,undefined,
                         undefined,undefined},
                     {connection_state,
                         {security_parameters,undefined,1,undefined,
                             undefined,undefined,undefined,undefined,
                             undefined,undefined,undefined,undefined,
                             undefined,undefined,
                             <<89,224,204,64,68,254,7,222,178,197,157,232,129,
                               29,172,21,220,151,148,191,128,165,246,24,11,131,
                               135,178,18,177,248,114>>,
                             undefined,undefined},
                         undefined,undefined,undefined,undefined,undefined,
                         undefined,undefined,undefined},
                     {connection_state,
                         {security_parameters,
                             <<0,0>>,
                             1,0,0,0,0,0,0,0,0,0,0,undefined,undefined,
                             undefined,undefined},
                         undefined,undefined,undefined,undefined,1,undefined,
                         undefined,undefined},
                     {connection_state,
                         {security_parameters,undefined,1,undefined,
                             undefined,undefined,undefined,undefined,
                             undefined,undefined,undefined,undefined,
                             undefined,undefined,
                             <<89,224,204,64,68,254,7,222,178,197,157,232,129,
                               29,172,21,220,151,148,191,128,165,246,24,11,131,
                               135,178,18,177,248,114>>,
                             undefined,undefined},
                         undefined,undefined,undefined,undefined,undefined,
                         undefined,undefined,undefined}},
                 {protocol_buffers,[],
                     <<22,3,3,2,15,12,0,2,11,0,128,214,125,228,64,203,187,220,
                       25,54,214,147,211,74,253,10,213,12,132,210,57,164,95,82,
                       11,184,129,116,203,152,188,233,81,132,159,145,46,99,156,
                       114,251,19,180,180,215,23,126,22,213,90,193,121,186,66,
                       11,42,41,254,50,74,70,122,99,94,129,255,89,1,55,123,237,
                       220,253,51,22,138,70,26,173,59,114,218,232,134,0,120,4,
                       91,7,167,219,202,120,116,8,125,21,16,234,159,204,157,
                       221,51,5,7,221,98,219,136,174,170,116,125,224,244,214,
                       226,189,104,176,231,57,62,15,36,33,142,179,0,1,2,0,128,
                       19,181,132,255,101,72,249,99,26,69,75,192,126,60,191,49,
                       63,153,169,65,145,139,227,147,102,16,28,252,243,192,22,
                       150,133,4,178,163,55,178,182,103,226,73,252,141,6,83,
                       184,27,186,178,48,165,54,204,206,226,167,2,185,193,59,
                       12,214,160,79,206,82,130,14,38,24,242,228,36,191,58,63,
                       202,55,183,82,8,179,219,122,118,167,132,68,28,226,13,
                       171,89,55,0,164,208,232,187,212,237,11,87,31,233,150,
                       137,51,153,192,230,117,194,72,35,198,12,43,148,133,37,
                       27,226,199,17,113,220,6,1,1,0,111,251,229,77,151,252,
                       187,232,116,224,42,228,113,46,87,154,124,2,120,224,82,
                       172,207,188,163,65,3,239,149,214,66,147,1,84,217,5,220,
                       63,157,36,112,169,173,104,96,140,18,56,71,223,198,46,
                       219,159,236,61,63,156,171,83,112,196,188,73,137,72,116,
                       50,137,184,8,213,158,11,187,229,162,227,36,190,95,136,
                       207,105,51,200,243,16,150,91,16,243,123,110,250,160,128,
                       41,138,134,222,96,196,141,227,146,243,241,75,28,192,194,
                       157,195,236,34,229,106,59,30,128,91,172,216,174,227,179,
                       11,175,134,7,10,31,240,189,206,73,226,72,170,207,174,
                       167,108,98,231,242,56,42,251,201,130,149,154,87,162,25,
                       255,114,144,143,155,239,44,187,195,63,50,148,176,125,90,
                       110,11,53,219,194,222,53,5,238,247,112,124,58,89,189,
                       223,12,51,117,142,165,126,95,192,113,151,239,230,185,91,
                       118,62,141,76,34,36,194,125,250,19,118>>,
                     <<>>,
                     [{ssl_tls,22,
                          {3,3},
                          <<2,0,0,81,3,3,89,224,204,69,250,192,106,42,242,154,
                            154,223,88,2,35,200,70,61,152,158,206,137,5,163,
                            62,254,183,178,122,56,123,173,32,78,128,107,99,
                            158,139,128,249,71,40,94,113,78,205,34,240,222,43,
                            71,218,135,103,251,37,211,9,56,29,113,126,107,84,
                            0,107,0,0,9,0,0,0,0,255,1,0,1,0>>},
                      {ssl_tls,22,
                          {3,3},
                          <<11,0,3,97,0,3,94,0,3,91,48,130,3,87,48,130,2,63,
                            160,3,2,1,2,2,9,0,238,107,27,251,218,186,177,
                            213,48,13,6,9,42,134,72,134,247,13,1,1,11,5,0,
                            48,66,49,11,48,9,6,3,85,4,6,19,2,85,75,49,21,48,
                            19,6,3,85,4,7,12,12,68,101,102,97,117,108,116,
                            32,67,105,116,121,49,28,48,26,6,3,85,4,10,12,19,
                            68,101,102,97,117,108,116,32,67,111,109,112,97,
                            110,121,32,76,116,100,48,30,23,13,49,54,49,49,
                            51,48,49,54,51,48,51,48,90,23,13,49,54,49,50,51,
                            48,49,54,51,48,51,48,90,48,66,49,11,48,9,6,3,85,
                            4,6,19,2,85,75,49,21,48,19,6,3,85,4,7,12,12,68,
                            101,102,97,117,108,116,32,67,105,116,121,49,28,
                            48,26,6,3,85,4,10,12,19,68,101,102,97,117,108,
                            116,32,67,111,109,112,97,110,121,32,76,116,100,
                            48,130,1,34,48,13,6,9,42,134,72,134,247,13,1,1,
                            1,5,0,3,130,1,15,0,48,130,1,10,2,130,1,1,0,205,
                            205,144,3,42,139,144,69,167,232,217,212,200,204,
                            203,61,81,17,72,20,249,36,83,70,207,121,115,16,
                            58,55,233,61,122,88,113,3,96,172,107,16,74,235,
                            102,159,52,77,182,131,54,185,194,138,191,151,58,
                            211,127,101,31,154,52,145,209,97,28,212,114,144,
                            123,118,233,49,127,228,88,22,61,13,96,59,48,172,
                            224,77,59,201,179,119,121,132,153,157,216,108,
                            237,231,222,23,166,121,95,230,43,147,95,231,70,
                            22,64,75,253,196,49,225,216,71,131,116,130,88,
                            71,108,217,113,160,96,60,98,163,148,56,101,218,
                            105,54,112,115,55,80,109,172,156,64,138,107,72,
                            235,42,250,107,91,179,58,109,183,141,104,171,93,
                            36,102,15,251,84,178,153,157,211,204,101,247,
                            132,80,18,105,81,37,105,60,219,151,103,82,80,
                            131,30,255,31,11,153,130,112,73,209,25,114,227,
                            174,175,218,43,67,72,61,84,108,107,129,97,136,
                            198,8,95,139,225,51,142,238,71,233,25,154,236,
                            162,108,117,42,20,240,231,55,193,78,126,112,89,
                            5,165,29,71,8,122,138,42,76,184,168,147,89,105,
                            30,238,134,227,193,91,2,3,1,0,1,163,80,48,78,48,
                            29,6,3,85,29,14,4,22,4,20,47,142,141,44,29,145,
                            71,163,239,15,10,131,48,6,223,44,27,175,52,111,
                            48,31,6,3,85,29,35,4,24,48,22,128,20,47,142,141,
                            44,29,145,71,163,239,15,10,131,48,6,223,44,27,
                            175,52,111,48,12,6,3,85,29,19,4,5,48,3,1,1,255,
                            48,13,6,9,42,134,72,134,247,13,1,1,11,5,0,3,130,
                            1,1,0,27,31,168,218,28,198,229,239,149,147,211,
                            132,120,213,158,134,127,30,16,226,91,221,233,
                            157,13,22,106,127,169,253,188,121,16,168,27,123,
                            251,52,141,61,111,236,205,153,43,35,246,182,172,
                            55,188,144,113,91,46,212,140,147,242,237,131,
                            237,40,39,222,117,189,92,140,101,69,227,92,19,
                            114,170,112,240,240,99,165,161,19,47,150,86,123,
                            11,215,182,50,115,135,60,101,231,225,140,24,78,
                            166,176,245,248,55,247,212,129,250,49,206,34,
                            186,10,223,92,209,171,123,5,209,244,131,181,213,
                            102,250,75,203,27,233,93,207,116,96,35,160,102,
                            89,88,210,115,25,2,197,224,192,39,8,49,51,208,
                            161,65,20,59,184,169,159,117,152,139,90,82,71,
                            67,213,25,49,186,124,101,207,129,78,58,222,182,
                            202,166,213,213,56,5,152,122,82,9,191,145,124,
                            243,20,167,195,36,62,31,248,24,146,47,3,191,201,
                            40,210,221,215,186,74,255,21,23,142,130,195,160,
                            221,132,111,209,183,177,213,33,163,141,50,110,
                            80,167,232,160,88,134,123,10,218,114,115,175,80,
                            37,157,38,64,6,50,85,165,155,148,225,191,107>>}]},
                 {[[1,
                    <<0,0,130>>,
                    <<3,3,89,224,204,64,68,254,7,222,178,197,157,232,129,29,
                      172,21,220,151,148,191,128,165,246,24,11,131,135,178,
                      18,177,248,114,0,0,40,0,255,0,107,0,106,0,61,0,103,0,
                      64,0,60,0,57,0,56,0,53,0,22,0,19,0,10,0,51,0,50,0,47,0,
                      5,0,4,0,21,0,9,1,0,0,49,0,0,0,25,0,23,0,0,20,50,51,49,
                      50,57,46,108,111,97,100,116,101,115,116,46,108,111,99,
                      97,108,0,13,0,16,0,14,6,1,5,1,4,1,3,1,2,1,2,2,1,1>>]],
                  []},
                 20498,
                 {session,<<>>,undefined,undefined,undefined,undefined,
                     undefined,undefined,new,63675127376,undefined},
                 32789,ts_ssl_session_cache,
                 {3,3},
                 false,undefined,
                 {undefined,undefined},
                 undefined,undefined,undefined,undefined,undefined,undefined,
                 undefined,undefined,undefined,24595,#Ref<0.0.0.679>,
                 undefined,<<>>,
                 {false,first},
                 {<0.417.0>,#Ref<0.0.0.677>},
                 undefined,
                 {[],[]},
                 false,true,false,undefined,undefined}],
            [{file,"tls_connection.erl"},{line,835}]},
        {tls_connection,handle_alerts,2,
            [{file,"tls_connection.erl"},{line,833}]},
        {gen_fsm,handle_msg,7,[{file,"gen_fsm.erl"},{line,505}]},
        {proc_lib,init_p_do_apply,3,[{file,"proc_lib.erl"},{line,239}]}]}

=ERROR REPORT==== 13-Oct-2017::15:22:56 ===
** State machine <0.417.0> terminating 
** Last message in was {timeout,#Ref<0.0.0.657>,end_thinktime}
** When State == think
**      Data  == {state_rcv,none,
                     {{1,2,199,62},0},
                     undefined,0,10000,"23129.loadtest.local",443,ts_ssl,
                     {proto_opts,negotiate,negotiate,"/http-bind/",false,
                         false,true,"/chat","binary",[],10,3,10000,infinity,
                         infinity,32768,32768,32768,32768,[],false,true},
                     false,1,undefined,true,undefined,
                     {1507,904576,648208},
                     7,7,false,undefined,0,[],<<>>,
                     {http,0,0,-1,
                         {none,none},
                         false,false,
                         {false,false},
                         [],"LoadTestUserAgent3-123456789123456789",[]},
                     0,110,524288,524288,
                     [{tsung_userid,110}],
                     ts_http,[],undefined,none}
** Reason for termination = 
** {{function_clause,
        [{tls_connection,handle_alert,
             [{alert,1,112,{"tls_connection.erl",375}},
              hello,
              {state,client,
                  {#Ref<0.0.0.676>,<0.417.0>},
                  gen_tcp,tls_connection,tcp,tcp_closed,tcp_error,
                  "23129.loadtest.local",443,#Port<0.1532>,
                  {ssl_options,undefined,
                      [{3,3},{3,2},{3,1}],
                      verify_none,
                      {#Fun<ssl.1.94144976>,[]},
                      false,false,undefined,1,<<>>,undefined,<<>>,undefined,
                      undefined,undefined,<<>>,undefined,undefined,undefined,
                      undefined,undefined,
                      [<<0,107>>,
                       <<0,106>>,
                       <<0,61>>,
                       <<0,103>>,
                       <<0,64>>,
                       <<0,60>>,
                       <<0,57>>,
                       <<0,56>>,
                       <<0,53>>,
                       <<0,22>>,
                       <<0,19>>,
                       <<0,10>>,
                       <<0,51>>,
                       <<0,50>>,
                       <<0,47>>,
                       <<0,5>>,
                       <<0,4>>,
                       <<0,21>>,
                       <<0,9>>],
                      #Fun<ssl.0.94144976>,false,268435456,false,undefined,
                      undefined,false,undefined,undefined,true,undefined,true},
                  {socket_options,binary,0,0,0,once},
                  {connection_states,
                      {connection_state,
                          {security_parameters,
                              <<0,0>>,
                              1,0,0,0,0,0,0,0,0,0,0,undefined,undefined,
                              undefined,undefined},
                          undefined,undefined,undefined,undefined,1,undefined,
                          undefined,undefined},
                      {connection_state,
                          {security_parameters,undefined,1,undefined,
                              undefined,undefined,undefined,undefined,
                              undefined,undefined,undefined,undefined,
                              undefined,undefined,
                              <<89,224,204,64,68,254,7,222,178,197,157,232,129,
                                29,172,21,220,151,148,191,128,165,246,24,11,
                                131,135,178,18,177,248,114>>,
                              undefined,undefined},
                          undefined,undefined,undefined,undefined,undefined,
                          undefined,undefined,undefined},
                      {connection_state,
                          {security_parameters,
                              <<0,0>>,
                              1,0,0,0,0,0,0,0,0,0,0,undefined,undefined,
                              undefined,undefined},
                          undefined,undefined,undefined,undefined,1,undefined,
                          undefined,undefined},
                      {connection_state,
                          {security_parameters,undefined,1,undefined,
                              undefined,undefined,undefined,undefined,
                              undefined,undefined,undefined,undefined,
                              undefined,undefined,
                              <<89,224,204,64,68,254,7,222,178,197,157,232,129,
                                29,172,21,220,151,148,191,128,165,246,24,11,
                                131,135,178,18,177,248,114>>,
                              undefined,undefined},
                          undefined,undefined,undefined,undefined,undefined,
                          undefined,undefined,undefined}},
                  {protocol_buffers,[],
                      <<22,3,3,2,15,12,0,2,11,0,128,214,125,228,64,203,187,220,
                        25,54,214,147,211,74,253,10,213,12,132,210,57,164,95,
                        82,11,184,129,116,203,152,188,233,81,132,159,145,46,99,
                        156,114,251,19,180,180,215,23,126,22,213,90,193,121,
                        186,66,11,42,41,254,50,74,70,122,99,94,129,255,89,1,55,
                        123,237,220,253,51,22,138,70,26,173,59,114,218,232,134,
                        0,120,4,91,7,167,219,202,120,116,8,125,21,16,234,159,
                        204,157,221,51,5,7,221,98,219,136,174,170,116,125,224,
                        244,214,226,189,104,176,231,57,62,15,36,33,142,179,0,1,
                        2,0,128,19,181,132,255,101,72,249,99,26,69,75,192,126,
                        60,191,49,63,153,169,65,145,139,227,147,102,16,28,252,
                        243,192,22,150,133,4,178,163,55,178,182,103,226,73,252,
                        141,6,83,184,27,186,178,48,165,54,204,206,226,167,2,
                        185,193,59,12,214,160,79,206,82,130,14,38,24,242,228,
                        36,191,58,63,202,55,183,82,8,179,219,122,118,167,132,
                        68,28,226,13,171,89,55,0,164,208,232,187,212,237,11,87,
                        31,233,150,137,51,153,192,230,117,194,72,35,198,12,43,
                        148,133,37,27,226,199,17,113,220,6,1,1,0,111,251,229,
                        77,151,252,187,232,116,224,42,228,113,46,87,154,124,2,
                        120,224,82,172,207,188,163,65,3,239,149,214,66,147,1,
                        84,217,5,220,63,157,36,112,169,173,104,96,140,18,56,71,
                        223,198,46,219,159,236,61,63,156,171,83,112,196,188,73,
                        137,72,116,50,137,184,8,213,158,11,187,229,162,227,36,
                        190,95,136,207,105,51,200,243,16,150,91,16,243,123,110,
                        250,160,128,41,138,134,222,96,196,141,227,146,243,241,
                        75,28,192,194,157,195,236,34,229,106,59,30,128,91,172,
                        216,174,227,179,11,175,134,7,10,31,240,189,206,73,226,
                        72,170,207,174,167,108,98,231,242,56,42,251,201,130,
                        149,154,87,162,25,255,114,144,143,155,239,44,187,195,
                        63,50,148,176,125,90,110,11,53,219,194,222,53,5,238,
                        247,112,124,58,89,189,223,12,51,117,142,165,126,95,192,
                        113,151,239,230,185,91,118,62,141,76,34,36,194,125,250,
                        19,118>>,
                      <<>>,
                      [{ssl_tls,22,
                           {3,3},
                           <<2,0,0,81,3,3,89,224,204,69,250,192,106,42,242,
                             154,154,223,88,2,35,200,70,61,152,158,206,137,5,
                             163,62,254,183,178,122,56,123,173,32,78,128,107,
                             99,158,139,128,249,71,40,94,113,78,205,34,240,
                             222,43,71,218,135,103,251,37,211,9,56,29,113,126,
                             107,84,0,107,0,0,9,0,0,0,0,255,1,0,1,0>>},
                       {ssl_tls,22,
                           {3,3},
                           <<11,0,3,97,0,3,94,0,3,91,48,130,3,87,48,130,2,
                             63,160,3,2,1,2,2,9,0,238,107,27,251,218,186,
                             177,213,48,13,6,9,42,134,72,134,247,13,1,1,11,
                             5,0,48,66,49,11,48,9,6,3,85,4,6,19,2,85,75,49,
                             21,48,19,6,3,85,4,7,12,12,68,101,102,97,117,
                             108,116,32,67,105,116,121,49,28,48,26,6,3,85,4,
                             10,12,19,68,101,102,97,117,108,116,32,67,111,
                             109,112,97,110,121,32,76,116,100,48,30,23,13,
                             49,54,49,49,51,48,49,54,51,48,51,48,90,23,13,
                             49,54,49,50,51,48,49,54,51,48,51,48,90,48,66,
                             49,11,48,9,6,3,85,4,6,19,2,85,75,49,21,48,19,6,
                             3,85,4,7,12,12,68,101,102,97,117,108,116,32,67,
                             105,116,121,49,28,48,26,6,3,85,4,10,12,19,68,
                             101,102,97,117,108,116,32,67,111,109,112,97,
                             110,121,32,76,116,100,48,130,1,34,48,13,6,9,42,
                             134,72,134,247,13,1,1,1,5,0,3,130,1,15,0,48,
                             130,1,10,2,130,1,1,0,205,205,144,3,42,139,144,
                             69,167,232,217,212,200,204,203,61,81,17,72,20,
                             249,36,83,70,207,121,115,16,58,55,233,61,122,
                             88,113,3,96,172,107,16,74,235,102,159,52,77,
                             182,131,54,185,194,138,191,151,58,211,127,101,
                             31,154,52,145,209,97,28,212,114,144,123,118,
                             233,49,127,228,88,22,61,13,96,59,48,172,224,77,
                             59,201,179,119,121,132,153,157,216,108,237,231,
                             222,23,166,121,95,230,43,147,95,231,70,22,64,
                             75,253,196,49,225,216,71,131,116,130,88,71,108,
                             217,113,160,96,60,98,163,148,56,101,218,105,54,
                             112,115,55,80,109,172,156,64,138,107,72,235,42,
                             250,107,91,179,58,109,183,141,104,171,93,36,
                             102,15,251,84,178,153,157,211,204,101,247,132,
                             80,18,105,81,37,105,60,219,151,103,82,80,131,
                             30,255,31,11,153,130,112,73,209,25,114,227,174,
                             175,218,43,67,72,61,84,108,107,129,97,136,198,
                             8,95,139,225,51,142,238,71,233,25,154,236,162,
                             108,117,42,20,240,231,55,193,78,126,112,89,5,
                             165,29,71,8,122,138,42,76,184,168,147,89,105,
                             30,238,134,227,193,91,2,3,1,0,1,163,80,48,78,
                             48,29,6,3,85,29,14,4,22,4,20,47,142,141,44,29,
                             145,71,163,239,15,10,131,48,6,223,44,27,175,52,
                             111,48,31,6,3,85,29,35,4,24,48,22,128,20,47,
                             142,141,44,29,145,71,163,239,15,10,131,48,6,
                             223,44,27,175,52,111,48,12,6,3,85,29,19,4,5,48,
                             3,1,1,255,48,13,6,9,42,134,72,134,247,13,1,1,
                             11,5,0,3,130,1,1,0,27,31,168,218,28,198,229,
                             239,149,147,211,132,120,213,158,134,127,30,16,
                             226,91,221,233,157,13,22,106,127,169,253,188,
                             121,16,168,27,123,251,52,141,61,111,236,205,
                             153,43,35,246,182,172,55,188,144,113,91,46,212,
                             140,147,242,237,131,237,40,39,222,117,189,92,
                             140,101,69,227,92,19,114,170,112,240,240,99,
                             165,161,19,47,150,86,123,11,215,182,50,115,135,
                             60,101,231,225,140,24,78,166,176,245,248,55,
                             247,212,129,250,49,206,34,186,10,223,92,209,
                             171,123,5,209,244,131,181,213,102,250,75,203,
                             27,233,93,207,116,96,35,160,102,89,88,210,115,
                             25,2,197,224,192,39,8,49,51,208,161,65,20,59,
                             184,169,159,117,152,139,90,82,71,67,213,25,49,
                             186,124,101,207,129,78,58,222,182,202,166,213,
                             213,56,5,152,122,82,9,191,145,124,243,20,167,
                             195,36,62,31,248,24,146,47,3,191,201,40,210,
                             221,215,186,74,255,21,23,142,130,195,160,221,
                             132,111,209,183,177,213,33,163,141,50,110,80,
                             167,232,160,88,134,123,10,218,114,115,175,80,
                             37,157,38,64,6,50,85,165,155,148,225,191,107>>}]},
                  {[[1,
                     <<0,0,130>>,
                     <<3,3,89,224,204,64,68,254,7,222,178,197,157,232,129,29,
                       172,21,220,151,148,191,128,165,246,24,11,131,135,178,
                       18,177,248,114,0,0,40,0,255,0,107,0,106,0,61,0,103,0,
                       64,0,60,0,57,0,56,0,53,0,22,0,19,0,10,0,51,0,50,0,47,
                       0,5,0,4,0,21,0,9,1,0,0,49,0,0,0,25,0,23,0,0,20,50,51,
                       49,50,57,46,108,111,97,100,116,101,115,116,46,108,111,
                       99,97,108,0,13,0,16,0,14,6,1,5,1,4,1,3,1,2,1,2,2,1,1>>]],
                   []},
                  20498,
                  {session,<<>>,undefined,undefined,undefined,undefined,
                      undefined,undefined,new,63675127376,undefined},
                  32789,ts_ssl_session_cache,
                  {3,3},
                  false,undefined,
                  {undefined,undefined},
                  undefined,undefined,undefined,undefined,undefined,undefined,
                  undefined,undefined,undefined,24595,#Ref<0.0.0.679>,
                  undefined,<<>>,
                  {false,first},
                  {<0.417.0>,#Ref<0.0.0.677>},
                  undefined,
                  {[],[]},
                  false,true,false,undefined,undefined}],
             [{file,"tls_connection.erl"},{line,835}]},
         {tls_connection,handle_alerts,2,
             [{file,"tls_connection.erl"},{line,833}]},
         {gen_fsm,handle_msg,7,[{file,"gen_fsm.erl"},{line,505}]},
         {proc_lib,init_p_do_apply,3,[{file,"proc_lib.erl"},{line,239}]}]},
    {gen_fsm,sync_send_all_state_event,[<0.419.0>,{start,infinity},infinity]}}

```

Network capture shows the SSL transaction starts but then is RST by the tsung client:

```
288 2.365862252  1.11.159.87 -> 192.168.88.109 TCP 74 17381 > https [SYN] Seq=0 Win=29200 Len=0 MSS=1460 SACK_PERM=1 TSval=375784022 TSecr=0 WS=128
289 2.365961761 192.168.88.109 -> 1.11.159.87  TCP 74 https > 17381 [SYN, ACK] Seq=0 Ack=1 Win=65535 Len=0 MSS=1460 SACK_PERM=1 TSval=3236049545 TSecr=375784022 WS=4096
290 2.365994647  1.11.159.87 -> 192.168.88.109 TCP 66 17381 > https [ACK] Seq=1 Ack=1 Win=29312 Len=0 TSval=375784022 TSecr=3236049545
291 2.366179364  1.11.159.87 -> 192.168.88.109 SSL 205 Client Hello
292 2.366244070 192.168.88.109 -> 1.11.159.87  TCP 66 https > 17381 [ACK] Seq=1 Ack=140 Win=135168 Len=0 TSval=3236049545 TSecr=375784022
293 2.371832472 192.168.88.109 -> 1.11.159.87  TLSv1.2 1578 Alert (Level: Warning, Description: Unrecognized Name), Server Hello, Certificate, Server Key Exchange, Server Hello Done
294 2.371853069  1.11.159.87 -> 192.168.88.109 TCP 66 17381 > https [ACK] Seq=140 Ack=1513 Win=32256 Len=0 TSval=375784028 TSecr=3236049550
295 2.371957989  1.11.159.87 -> 192.168.88.109 TCP 66 17381 > https [RST, ACK] Seq=140 Ack=1513 Win=32256 Len=0 TSval=0 TSecr=3236049550

```

**Comment by darrentodd** [comment]
When I change the test to be HTTP (not HTTPS) ie the type="tcp" and port="80" all is good
